{
  "schemaVersion": 1,
  "tool": {
    "name": "loadtool",
    "version": "v0.0.0-test"
  },
  "script": "examples/basic-http.ts",
  "status": "interrupted",
  "outcome": {
    "passed": false,
    "exitCode": 1,
    "reasons": [
      "interrupted"
    ]
  },
  "startedAt": "",
  "elapsedMs": 2000,
  "teardownError": "",
  "config": {
    "vus": 100,
    "durationMs": 30000,
    "scenarios": []
  },
  "metrics": {
    "http_reqs": {
      "count": 2,
      "rate": 1
    },
    "http_req_failed": {
      "rate": 1,
      "failed": 2,
      "count": 2
    },
    "http_req_duration": null,
    "http_req_duration_successful": null,
    "iterations": {
      "count": 0,
      "rate": 0
    },
    "dropped_iterations": {
      "count": 0,
      "rate": 0
    },
    "checks": {
      "rate": null,
      "passes": 0,
      "fails": 0,
      "count": 0
    },
    "script_errors": {
      "count": 1,
      "first": "TypeError: x"
    },
    "http_protocols": {
      "http1": 0,
      "http2": 0,
      "other": 0
    },
    "http_status_codes": {}
  },
  "checks": [],
  "thresholds": [],
  "series": []
}
